{
  "extensions": [
    "mp4",
    "avi",
    "mkv",
    "wmv",
    "mov",
    "flv",
    "m4v",
    "mpg",
    "MP4",
    "AVI",
    "MKV",
    "WMV",
    "MOV",
    "FLV",
    "M4V"
  ],
  "resolution_markers": [
    "UHD1080p",
    "UHD720p",
    "FHD1080p",
    "FHD720p",
    "HD1080p",
    "HD720p",
    "HD480p",
    "HD360p",
    "2160p",
    "1080p",
    "1080P",
    "720p",
    "540p",
    "480p",
    "360p",
    "240p",
    "2160",
    "1080",
    "720",
    "480",
    "360",
    "240",
    "FHD",
    "4K",
    "4k",
    "2K",
    "2k"
  ],
  "quality_markers": [
    "HQ",
    "UHD",
    "HD",
    "SDR"
  ],
  "source_markers": [
    "DVD-RIP",
    "DVD5-RIP",
    "DVDRip",
    "DVDRIP",
    "dvdrip",
    "WEBRip",
    "WEBRIP",
    "webrip",
    "WEB-DL",
    "WEB DL",
    "WEBDL"
  ],
  "format_markers": [
    "3D-SBS",
    "3D SBS",
    "h264",
    "h265",
    "x264",
    "x265",
    "hevc",
    "HEVC"
  ],
  "misc_markers": [
    "original size",
    "(b)",
    "(t)",
    "(bt)"
  ],
  "trimming_strings": [
    ".",
    " () ",
    " ()",
    "() ",
    "()",
    " - ",
    " -",
    "- ",
    "-",
    " []",
    "[] ",
    "[]",
    " ",
    "_"
  ],
  "replace_with_dash": [
    "()",
    "[]",
    "- -",
    "___",
    "__"
  ],
  "junk_tokens": [
    "Gay",
    "gay",
    "GAY",
    "Bareback",
    "bareback",
    "BAREBACK",
    "BareBack",
    "1080p",
    "1080P",
    "720p",
    "720P",
    "4k",
    "4K",
    "h264",
    "H264",
    "h265",
    "H265",
    "x264",
    "X264",
    "x265",
    "X265",
    "hevc",
    "HEVC",
    "dvdrip",
    "DVDRIP",
    "DVDRip",
    "webrip",
    "WEBRIP",
    "WEBRip",
    "web-dl",
    "WEB-DL",
    "WEBDL",
    "WebDL",
    "Individual Scenes",
    "Collection",
    "Collections",
    "collection",
    "collections",
    "Bundle",
    "bundle",
    "MOVIES PACK",
    "Movies Pack"
  ],
  "non_performer_words": [
    "scene",
    "movie",
    "video",
    "clip",
    "episode",
    "part",
    "series",
    "collection",
    "compilation",
    "best",
    "of",
    "the",
    "in",
    "on",
    "at",
    "to",
    "from",
    "with",
    "for",
    "by",
    "de",
    "la",
    "el",
    "les",
    "des",
    "et",
    "und",
    "en",
    "y",
    "e",
    "vs",
    "versus",
    "presents",
    "features",
    "starring",
    "friends",
    "and",
    "movie",
    "scene",
    "video",
    "clip",
    "bareback",
    "sweat",
    "apples",
    "barefoot",
    "fisted",
    "juicy",
    "sunscreen",
    "beautiful"
  ],
  "studio_codes": [
    {
      "code": "ACM####",
      "studio": "Corbin Fisher",
      "normalize": {
        "strip_prefix_letters": true,
        "strip_leading_zeros": true
      },
      "allow_suffix": true
    },
    {
      "code": "ACM####-####",
      "studio": "Corbin Fisher",
      "normalize": {
        "strip_prefix_letters": true,
        "strip_leading_zeros": true
      },
      "allow_suffix": true
    },
    {
      "code": "ACT###",
      "studio": "Active Duty",
      "allow_suffix": true
    },
    {
      "code": "AD####",
      "studio": "Active Duty",
      "allow_suffix": true
    },
    {
      "code": "FX###",
      "studio": "FratX",
      "allow_suffix": true
    },
    {
      "code": "SC####",
      "studio": "Sean Cody",
      "normalize": {
        "strip_prefix_letters": true,
        "strip_leading_zeros": true
      },
      "allow_suffix": true
    },
    {
      "code": "SC-####",
      "studio": "Sean Cody",
      "normalize": {
        "strip_prefix_letters": true,
        "strip_leading_zeros": true
      },
      "allow_suffix": true
    },
    {
      "code": "SC####-####",
      "studio": "Sean Cody",
      "normalize": {
        "strip_prefix_letters": true,
        "strip_leading_zeros": true
      },
      "allow_suffix": true
    },
    {
      "code": "####_##",
      "studio": "Scary Fuckers",
      "normalize": {
        "replace_underscores_with_dash": true
      },
      "allow_suffix": true
    },
    {
      "code": "Incident ###",
      "studio": "Boys Halfway House",
      "normalize": {
        "strip_prefix_letters": true,
        "strip_leading_zeros": true
      },
      "allow_suffix": true
    },
    {
      "code": "Incident \\# ###",
      "studio": "Boys Halfway House",
      "normalize": {
        "strip_prefix_letters": true,
        "strip_leading_zeros": true
      },
      "allow_suffix": true
    },
    {
      "code": "MK#######",
      "studio": null,
      "normalize": {
        "strip_prefix_letters": true,
        "strip_leading_zeros": true
      },
      "allow_suffix": true
    },
    {
      "regex": "[A-Z]{2,4}[-\\s]?\\d{3,5}",
      "studio": null,
      "allow_suffix": true
    }
  ]
}
